{
  "topic": "Python for loops",
  "slug": "python_for_loops",
  "title": "Mastering Python For Loops",
  "language": "Python",
  "language_version": "Python 3.9+",
  "audience": "Beginner programmers in Indian colleges writing their first Python loops",
  "prerequisites": [
    "Python variables",
    "The print function",
    "Basic arithmetic operators"
  ],
  "difficulty": "beginner",
  "duration_minutes": 3.3,
  "lesson_objective": "After watching, the learner can write a for loop over range and predict each line it prints.",
  "short_description": "A visual introduction to Python for loops: iteration, range start and stop rules, and the loop body.",
  "course_category": "Python Foundations",
  "voice_profile": {
    "persona": "Patient instructor explaining at a whiteboard",
    "accent_language": "Clear neutral Indian English",
    "target_pace_wpm": 130,
    "speed_multiplier": 1.0,
    "tone": "Warm, confident, and beginner-friendly",
    "energy": "Medium with gentle variation",
    "modulation": "Slow slightly while tracing iterations; emphasize the range rule",
    "pronunciation_dictionary": [
      {
        "written": "range(1, 6)",
        "spoken": "range of one comma six"
      }
    ],
    "provider_notes": "gTTS with tld co.in. Express rhythm through punctuation and short sentences; gTTS has no pitch or emotion controls."
  },
  "scenes": [
    {
      "id": "scene_01_intro",
      "type": "intro",
      "title": "Meet the For Loop",
      "purpose": "Set the goal: repeat work over a sequence without copying code.",
      "voiceover": "Welcome to AI Sankalp. Today we will learn the Python for loop. By the end, you will be able to repeat an action for every item in a sequence, and predict exactly what the loop prints.",
      "voice_delivery": {
        "pace_wpm": 140,
        "tone": "Welcoming",
        "energy": "Medium",
        "modulation": "Lift gently on the lesson promise",
        "emphasis_words": [
          "for loop",
          "predict"
        ],
        "pronunciation_notes": [],
        "pause_before_seconds": 0.0,
        "pause_after_seconds": 0.5
      },
      "on_screen_text": [
        "Python For Loops",
        "Repeat • Iterate • Predict"
      ],
      "visual_objects": [
        "asset_branding",
        "asset_title_card"
      ],
      "animation_notes": [
        "Reveal the title, then the three learning verbs."
      ],
      "code_example_ids": [],
      "timing_seconds": 14,
      "transition": "Title fades into the motivation cards."
    },
    {
      "id": "scene_02_motivation",
      "type": "motivation",
      "title": "Why Not Copy and Paste?",
      "purpose": "Show why repetition needs a loop.",
      "voiceover": "Suppose you want to print the squares of the numbers one to five. You could write five print statements. But what if you need one hundred numbers? Copying code is slow and easy to get wrong. A loop writes the action once and repeats it for you.",
      "voice_delivery": {
        "pace_wpm": 134,
        "tone": "Curious",
        "energy": "Medium",
        "modulation": "Slow down on the one hundred numbers question",
        "emphasis_words": [
          "one hundred",
          "once"
        ],
        "pronunciation_notes": [],
        "pause_before_seconds": 0.0,
        "pause_after_seconds": 0.5
      },
      "on_screen_text": [
        "print(1 * 1) ... print(5 * 5)",
        "What about 100 numbers?",
        "Write it once: for"
      ],
      "visual_objects": [
        "asset_branding",
        "asset_comparison_cards"
      ],
      "animation_notes": [
        "Stack five repeated print cards, then collapse them into one loop card."
      ],
      "code_example_ids": [],
      "timing_seconds": 22,
      "transition": "Loop card moves into the explanation."
    },
    {
      "id": "scene_03_explanation",
      "type": "explanation",
      "title": "How One Iteration Works",
      "purpose": "Build the mental model of a single pass.",
      "voiceover": "A for loop walks through a sequence one item at a time. Python takes the first item and stores it in the loop variable. Then it runs the indented body. When the body finishes, Python moves to the next item and repeats. When there are no items left, the loop ends.",
      "voice_delivery": {
        "pace_wpm": 130,
        "tone": "Patient",
        "energy": "Medium",
        "modulation": "Pause briefly after each stage of the cycle",
        "emphasis_words": [
          "one item at a time",
          "indented body"
        ],
        "pronunciation_notes": [],
        "pause_before_seconds": 0.0,
        "pause_after_seconds": 0.5
      },
      "on_screen_text": [
        "Take next item",
        "Store in loop variable",
        "Run the body",
        "Repeat until done"
      ],
      "visual_objects": [
        "asset_branding",
        "asset_iteration_flow"
      ],
      "animation_notes": [
        "Reveal the iteration cycle as a four-step flow, highlighting each step as it is named."
      ],
      "code_example_ids": [],
      "timing_seconds": 26,
      "transition": "Flow shrinks beside the range explanation."
    },
    {
      "id": "scene_04_range",
      "type": "explanation",
      "title": "Counting With range",
      "purpose": "Explain range start and stop rules.",
      "voiceover": "To count, we often loop over range. Range of one comma six produces the numbers one, two, three, four, and five. The start value is included, but the stop value is excluded. That is why six never appears.",
      "voice_delivery": {
        "pace_wpm": 128,
        "tone": "Clear",
        "energy": "Medium",
        "modulation": "Emphasize included and excluded",
        "emphasis_words": [
          "included",
          "excluded"
        ],
        "pronunciation_notes": [],
        "pause_before_seconds": 0.0,
        "pause_after_seconds": 0.5
      },
      "on_screen_text": [
        "range(1, 6)",
        "1  2  3  4  5",
        "start included • stop excluded"
      ],
      "visual_objects": [
        "asset_branding",
        "asset_number_strip"
      ],
      "animation_notes": [
        "Show range(1, 6) and reveal the five produced numbers; cross out 6."
      ],
      "code_example_ids": [],
      "timing_seconds": 20,
      "transition": "Number strip slides under the code panel."
    },
    {
      "id": "scene_05_code",
      "type": "code_walkthrough",
      "title": "Read the Program",
      "purpose": "Connect the loop syntax to its behavior.",
      "voiceover": "Here is the complete program. The first line says: for number in range one comma six, followed by a colon. The two indented lines form the loop body. The body computes the square of number, and then prints the number and its square. Indentation tells Python which lines belong to the loop.",
      "voice_delivery": {
        "pace_wpm": 126,
        "tone": "Methodical",
        "energy": "Medium",
        "modulation": "Slow for each code line",
        "emphasis_words": [
          "colon",
          "indented",
          "body"
        ],
        "pronunciation_notes": [],
        "pause_before_seconds": 0.0,
        "pause_after_seconds": 0.5
      },
      "on_screen_text": [
        "for number in range(1, 6):",
        "Indented lines = loop body"
      ],
      "visual_objects": [
        "asset_branding",
        "asset_code_panel"
      ],
      "animation_notes": [
        "Reveal the code and highlight the header, the square line, and the print line in order."
      ],
      "code_example_ids": [
        "code_01_main"
      ],
      "timing_seconds": 28,
      "transition": "Code panel stays as the trace begins."
    },
    {
      "id": "scene_06_trace",
      "type": "visual_trace",
      "title": "Trace Every Pass",
      "purpose": "Trace the loop variable and the output.",
      "voiceover": "Let us trace it. First, number is one, so the program prints one and one. Next, number is two, and it prints two and four. Then three and nine. Then four and sixteen. Finally five and twenty five. Range has no more numbers, so the loop stops.",
      "voice_delivery": {
        "pace_wpm": 124,
        "tone": "Focused",
        "energy": "Medium",
        "modulation": "Even rhythm for each iteration",
        "emphasis_words": [
          "one",
          "twenty five",
          "stops"
        ],
        "pronunciation_notes": [],
        "pause_before_seconds": 0.0,
        "pause_after_seconds": 0.5
      },
      "on_screen_text": [
        "number: 1 → 2 → 3 → 4 → 5",
        "output: 1 1, 2 4, 3 9, 4 16, 5 25"
      ],
      "visual_objects": [
        "asset_branding",
        "asset_trace_table"
      ],
      "animation_notes": [
        "Move a marker across the numbers and append each output row."
      ],
      "code_example_ids": [
        "code_01_main"
      ],
      "timing_seconds": 26,
      "transition": "Output table fades as the mistake appears."
    },
    {
      "id": "scene_07_mistake",
      "type": "common_mistake",
      "title": "The Indentation Mistake",
      "purpose": "Show how missing indentation breaks the loop body.",
      "voiceover": "A common mistake is forgetting to indent the loop body. If no line under the for header is indented, Python raises an IndentationError, because the header expects an indented block. Always indent the body, usually by four spaces.",
      "voice_delivery": {
        "pace_wpm": 128,
        "tone": "Cautionary",
        "energy": "Medium",
        "modulation": "Slightly firmer on the error name",
        "emphasis_words": [
          "IndentationError",
          "four spaces"
        ],
        "pronunciation_notes": [],
        "pause_before_seconds": 0.0,
        "pause_after_seconds": 0.5
      },
      "on_screen_text": [
        "Wrong: nothing indented under for",
        "IndentationError: expected an indented block",
        "Correct: indent the body by 4 spaces"
      ],